{
  "schema_version": 1,
  "id": "task-0001-desktop-file-edit",
  "title": "Installable desktop file editing",
  "outcome": "Install the desktop app, authorize a folder, edit and save a file, and recover an unsaved draft after restart.",
  "status": "planned",
  "feature_ids": ["F-001", "F-002", "F-017"],
  "scenario_ids": ["A-001", "T-001", "T-003"],
  "modules": ["workspace", "files", "editor", "contracts", "ui-kit", "runtime"],
  "allowed_paths": ["apps/", "packages/", "tools/studio-cli/", "architecture/", "tests/", "tasks/", "docs/", "package.json", "bun.lock", "tsconfig.json", "AGENTS.md", "README.md"],
  "contract_changes": ["Introduce validated local bootstrap, file operations, and draft persistence contracts."],
  "migration_changes": ["Create initial workspace/file/draft metadata with explicit owners."],
  "acceptance_checks": [
    { "id": "architecture-baseline", "description": "Reject invalid names and forbidden imports; print a correct repository map.", "required": true },
    { "id": "file-save-conflict", "description": "Exercise real safe save and detect an external version conflict.", "required": true },
    { "id": "draft-recovery", "description": "Restart the application and recover an unsaved draft.", "required": true },
    { "id": "installed-native-smoke", "description": "Install and launch the packaged app without external development runtimes.", "required": true }
  ],
  "blockers": [],
  "evidence": []
}
